{
  "schemaVersion": "1.0",
  "kind": "agentlas-super-ontology-knowledge-homeostasis",
  "state": "export_only",
  "runtimePromotionAllowed": false,
  "defaultDecision": "homeostasis_required_before_runtime_or_memory_write",
  "signals": [
    "contradiction_rate",
    "stale_claim_age",
    "schema_violation_rate",
    "parser_error_rate",
    "unsupported_claim_rate",
    "repair_backlog",
    "replay_failure_rate",
    "drift_rate",
    "source_freshness",
    "authority_expiry",
    "privacy_incident",
    "promotion_evidence_gap",
    "user_correction_rate",
    "runtime_desync_rate"
  ],
  "decisions": [
    "continue",
    "quarantine",
    "degrade_to_read_only",
    "require_review",
    "replay",
    "repair",
    "rollback",
    "block_promotion",
    "retire"
  ],
  "requiredParameters": [
    "monitored_artifact",
    "scope_id",
    "surface",
    "signal_type",
    "measurement",
    "severity",
    "affected_contexts",
    "affected_lenses",
    "affected_claims",
    "affected_surfaces",
    "error_budget",
    "control_decision",
    "automation_level",
    "escalation",
    "evidence_refs",
    "rollback_plan",
    "memory_curator_policy",
    "public_export_policy"
  ],
  "researchBasis": [
    "shacl_validation",
    "kg_repair_evaluation",
    "ontology_change_propagation",
    "truth_maintenance",
    "data_observability",
    "resilience_engineering",
    "homeostatic_control",
    "w3c_prov",
    "nist_ai_rmf",
    "ai_agent_index"
  ],
  "hardStops": [
    "error_budget_overrun_continues",
    "critical_homeostasis_runtime_write",
    "privacy_incident_public_export",
    "appbridge_route_as_source_authority",
    "stale_claim_as_current_truth",
    "parser_error_as_complete_source",
    "missing_homeostasis_evidence",
    "memory_write_without_ticket_or_quarantine",
    "runtime_desync_ignored",
    "literal_perfection_claim"
  ]
}
